{
  "schemaVersion": 1,
  "id": "human-rig-v2",
  "displayName": "Гуманоид — риг по исходным пропорциям",
  "description": "Перенесённый и упрощённый риг из Modular Character Studio: измеренные длины корпуса и конечностей взяты из canonicalTargetPixels. Для RimClone преобразованы координаты, стороны симметризированы; корпус и шея объединены в один сегмент, голова — отдельный сегмент. Исходная художественная графика не копируется.",
  "runtimeTypeId": 1024,
  "stats": {
    "bodyType": "Colonist",
    "moveSpeed": 2.8,
    "width": 0.35,
    "length": 0.6,
    "height": 1.75,
    "viewRange": 20,
    "fieldOfView": 110,
    "bodyMassKg": 75,
    "muscleMassKg": 30,
    "bodyFatKg": 13,
    "bloodLiters": 5,
    "baseEnergyKcal": 2200,
    "baseWaterLiters": 2.5,
    "strength": 4,
    "constitution": 4,
    "dexterity": 4,
    "intelligence": 4
  },
  "regions": [
    {
      "id": "body.torso",
      "hitHalfHeight": 0.22058823529411764,
      "part": {
        "id": "body.torso",
        "parentIndex": -1,
        "x": 0.30756302521008405,
        "y": 0,
        "z": 0.8970588235294118,
        "scaleX": 0.07563025210084033,
        "scaleY": 0.13096774193548386,
        "scaleZ": 0.22058823529411764,
        "rotation": 0,
        "rotationX": 0,
        "rotationY": 0,
        "followDistance": 0,
        "primitive": "Circle",
        "motion": "StaticRelative",
        "anchor": "Parent",
        "role": "Torso",
        "pivot": "Center",
        "symmetryPartnerId": null,
        "displayName": "Туловище — единый сегмент"
      },
      "tissues": [
        {
          "id": "torso.main",
          "parentId": "",
          "part": "Torso",
          "parentPart": "None",
          "kind": "BodyPart",
          "weight": 14,
          "maxHitPoints": 60,
          "armorZone": -1,
          "projectileEnergyLoss": 190,
          "projectilePenetrationLoss": 12
        },
        {
          "id": "heart.main",
          "parentId": "torso.main",
          "part": "Heart",
          "parentPart": "None",
          "kind": "Organ",
          "weight": 0.3,
          "maxHitPoints": 15,
          "armorZone": -1,
          "projectileEnergyLoss": -1,
          "projectilePenetrationLoss": -1
        },
        {
          "id": "lung.left",
          "parentId": "torso.main",
          "part": "LeftLung",
          "parentPart": "None",
          "kind": "Organ",
          "weight": 0.25,
          "maxHitPoints": 12,
          "armorZone": -1,
          "projectileEnergyLoss": -1,
          "projectilePenetrationLoss": -1
        },
        {
          "id": "lung.right",
          "parentId": "torso.main",
          "part": "RightLung",
          "parentPart": "None",
          "kind": "Organ",
          "weight": 0.25,
          "maxHitPoints": 12,
          "armorZone": -1,
          "projectileEnergyLoss": -1,
          "projectilePenetrationLoss": -1
        },
        {
          "id": "stomach.main",
          "parentId": "torso.main",
          "part": "Stomach",
          "parentPart": "None",
          "kind": "Organ",
          "weight": 0.18,
          "maxHitPoints": 12,
          "armorZone": -1,
          "projectileEnergyLoss": -1,
          "projectilePenetrationLoss": -1
        },
        {
          "id": "liver.main",
          "parentId": "torso.main",
          "part": "Liver",
          "parentPart": "None",
          "kind": "Organ",
          "weight": 0.2,
          "maxHitPoints": 15,
          "armorZone": -1,
          "projectileEnergyLoss": -1,
          "projectilePenetrationLoss": -1
        },
        {
          "id": "kidney.left",
          "parentId": "torso.main",
          "part": "LeftKidney",
          "parentPart": "None",
          "kind": "Organ",
          "weight": 0.12,
          "maxHitPoints": 10,
          "armorZone": -1,
          "projectileEnergyLoss": -1,
          "projectilePenetrationLoss": -1
        },
        {
          "id": "kidney.right",
          "parentId": "torso.main",
          "part": "RightKidney",
          "parentPart": "None",
          "kind": "Organ",
          "weight": 0.12,
          "maxHitPoints": 10,
          "armorZone": -1,
          "projectileEnergyLoss": -1,
          "projectilePenetrationLoss": -1
        }
      ],
      "markers": [
        {
          "id": "marker.torso.target",
          "roles": "Target, Aim, Vision",
          "x": 0,
          "y": 0,
          "z": 0
        },
        {
          "id": "marker.torso.locomotion",
          "roles": "Locomotion",
          "x": 0,
          "y": 0,
          "z": 0
        }
      ]
    },
    {
      "id": "body.head",
      "hitHalfHeight": 0.11029411764705882,
      "part": {
        "id": "body.head",
        "parentIndex": 0,
        "x": 0.1411764705882353,
        "y": 0,
        "z": 0.4117647058823529,
        "scaleX": 0.037815126050420166,
        "scaleY": 0.05504032258064515,
        "scaleZ": 0.11029411764705882,
        "rotation": 0,
        "rotationX": 0,
        "rotationY": 0,
        "followDistance": 0,
        "primitive": "Circle",
        "motion": "StaticRelative",
        "anchor": "Parent",
        "role": "Head",
        "pivot": "Center",
        "symmetryPartnerId": null,
        "displayName": "Голова"
      },
      "tissues": [
        {
          "id": "head.main",
          "parentId": "torso.main",
          "part": "Head",
          "parentPart": "None",
          "kind": "BodyPart",
          "weight": 19,
          "maxHitPoints": 40,
          "armorZone": -1,
          "projectileEnergyLoss": 170,
          "projectilePenetrationLoss": 10
        },
        {
          "id": "brain.main",
          "parentId": "head.main",
          "part": "Brain",
          "parentPart": "None",
          "kind": "Organ",
          "weight": 1,
          "maxHitPoints": 10,
          "armorZone": -1,
          "projectileEnergyLoss": -1,
          "projectilePenetrationLoss": -1
        }
      ],
      "markers": [
        {
          "id": "marker.head.eye",
          "roles": "Eye, Vision",
          "x": 0,
          "y": 0,
          "z": 0.015
        },
        {
          "id": "marker.head.target",
          "roles": "Target, Aim, Vision",
          "x": 0,
          "y": 0,
          "z": 0
        },
        {
          "id": "marker.head.muzzle",
          "roles": "Muzzle",
          "x": 0.035,
          "y": 0,
          "z": 0.005
        }
      ]
    },
    {
      "id": "body.arm.left.upper",
      "hitHalfHeight": 0.09726470588235292,
      "part": {
        "id": "body.arm.left.upper",
        "parentIndex": 0,
        "x": 0.02521008403361341,
        "y": 0.175,
        "z": -0.023735294117647077,
        "scaleX": 0.03702160636580518,
        "scaleY": 0.02258064516129032,
        "scaleZ": 0.09726470588235292,
        "rotation": -2.692332268027561,
        "rotationX": 0,
        "rotationY": 0,
        "followDistance": 0,
        "primitive": "Circle",
        "motion": "WalkCycle",
        "anchor": "Parent",
        "role": "UpperArm",
        "pivot": "Start",
        "symmetryPartnerId": "body.arm.right.upper",
        "displayName": "Плечо левой руки"
      },
      "tissues": [
        {
          "id": "arm.left",
          "parentId": "torso.main",
          "part": "LeftArm",
          "parentPart": "None",
          "kind": "BodyPart",
          "weight": 2,
          "maxHitPoints": 30,
          "armorZone": -1,
          "projectileEnergyLoss": 90,
          "projectilePenetrationLoss": 6
        }
      ],
      "markers": [
        {
          "id": "marker.body.arm.left.upper.target",
          "roles": "Target, Aim",
          "x": 0,
          "y": 0,
          "z": 0
        }
      ]
    },
    {
      "id": "body.arm.left.lower",
      "hitHalfHeight": 0.061727941176470624,
      "part": {
        "id": "body.arm.left.lower",
        "parentIndex": 2,
        "x": 0.07404321273161037,
        "y": -1.0408340855860843e-17,
        "z": -0.15899264705882354,
        "scaleX": 0.02693660211402664,
        "scaleY": 0.01693548387096774,
        "scaleZ": 0.061727941176470624,
        "rotation": 0.21772241937470493,
        "rotationX": 0,
        "rotationY": 0,
        "followDistance": 0,
        "primitive": "Circle",
        "motion": "WalkCycle",
        "anchor": "Parent",
        "role": "Forearm",
        "pivot": "Start",
        "symmetryPartnerId": "body.arm.right.lower",
        "displayName": "Предплечье левой руки"
      },
      "tissues": [
        {
          "id": "hand.left",
          "parentId": "arm.left",
          "part": "LeftHand",
          "parentPart": "None",
          "kind": "BodyPart",
          "weight": 0.5,
          "maxHitPoints": 12,
          "armorZone": -1,
          "projectileEnergyLoss": 55,
          "projectilePenetrationLoss": 4
        }
      ],
      "markers": [
        {
          "id": "marker.body.arm.left.lower.target",
          "roles": "Target, Aim",
          "x": 0,
          "y": 0,
          "z": 0
        }
      ]
    },
    {
      "id": "body.arm.right.upper",
      "hitHalfHeight": 0.09726470588235292,
      "part": {
        "id": "body.arm.right.upper",
        "parentIndex": 0,
        "x": 0.02521008403361341,
        "y": -0.175,
        "z": -0.023735294117647077,
        "scaleX": 0.03702160636580518,
        "scaleY": 0.02258064516129032,
        "scaleZ": 0.09726470588235292,
        "rotation": 2.692332268027561,
        "rotationX": 0,
        "rotationY": 0,
        "followDistance": 0,
        "primitive": "Circle",
        "motion": "WalkCycleOpposite",
        "anchor": "Parent",
        "role": "UpperArm",
        "pivot": "Start",
        "symmetryPartnerId": "body.arm.left.upper",
        "displayName": "Плечо правой руки"
      },
      "tissues": [
        {
          "id": "arm.right",
          "parentId": "torso.main",
          "part": "RightArm",
          "parentPart": "None",